{"digest_sha256":"3de82636aa72b594c1caf243c265307462fbb7e2c1c19b43bdab3390459b6fd8","events":[{"detail":"fixture event 1","event_id":"00000000-0000-0000-0000-000000000001","kind":"job_lifecycle","raw_event":"job_created","role":"system","seq":1,"timestamp":"2025-01-02T03:04:05+00:00"}],"job_id":"00000000-0000-0000-0000-000000000000","org_digest":null,"schema_version":"autobuild-org-run-events-v1"}